<?xml version="1.0" encoding="UTF-8"?>
<!-- edited with XML Spy v4.4 U (http://www.xmlspy.com) by Wm. Mark Stubbeman (Cisco Systems, Inc.) -->
<!--Sample XML file generated by XML Spy v4.4 U (http://www.xmlspy.com)-->
<applications xmlns:xsi="http://www.w3.org/2001/XMLSchema-instance" xsi:noNamespaceSchemaLocation="..\..\schema\Applications.xsd">
	<appType>
		<name>HostResources</name>
		<rulebaseName>Linux2x</rulebaseName>
		<rulebaseName>Solaris2x</rulebaseName>
		<rulebaseName>Win2000</rulebaseName>
		<rulebaseName>WinXP</rulebaseName>
		<appInstance>
			<id>HostResources</id>
			<instrumentation>
				<name>COM.TIBCO.hawk.hma.EventLog</name>
				<method>
					<name>TBD</name>
					<description>TBD</description>
				</method>
			</instrumentation>
			<instrumentation>
				<name>COM.TIBCO.hawk.hma.FileStat</name>
				<method>
					<name>TBD</name>
					<description>TBD</description>
				</method>
			</instrumentation>
			<instrumentation>
				<name>COM.TIBCO.hawk.hma.FileSystem</name>
				<method>
					<name>TBD</name>
					<description>TBD</description>
				</method>
			</instrumentation>
			<instrumentation>
				<name>COM.TIBCO.hawk.hma.Network</name>
				<method>
					<name>TBD</name>
					<description>TBD</description>
				</method>
			</instrumentation>
			<instrumentation>
				<name>COM.TIBCO.hawk.hma.Performance</name>
				<method>
					<name>TBD</name>
					<description>TBD</description>
				</method>
			</instrumentation>
			<instrumentation>
				<name>COM.TIBCO.hawk.hma.Process</name>
				<method>
					<name>TBD</name>
					<description>TBD</description>
				</method>
			</instrumentation>
			<instrumentation>
				<name>COM.TIBCO.hawk.hma.Registry</name>
				<method>
					<name>TBD</name>
					<description>TBD</description>
				</method>
			</instrumentation>
			<instrumentation>
				<name>COM.TIBCO.hawk.hma.Services</name>
				<method>
					<name>TBD</name>
					<description>TBD</description>
				</method>
			</instrumentation>
			<instrumentation>
				<name>COM.TIBCO.hawk.hma.System</name>
				<method>
					<name>TBD</name>
					<description>TBD</description>
				</method>
			</instrumentation>
			<instrumentation>
				<name>COM.TIBCO.hawk.hma.TibRendezvous</name>
				<method>
					<name>TBD</name>
					<description>TBD</description>
				</method>
			</instrumentation>
			<instrumentation>
				<name>COM.TIBCO.hawk.microagent.Custom</name>
				<method>
					<name>TBD</name>
					<description>TBD</description>
				</method>
			</instrumentation>
			<instrumentation>
				<name>COM.TIBCO.hawk.microagent.Logfile</name>
				<method>
					<name>TBD</name>
					<description>TBD</description>
				</method>
			</instrumentation>
			<instrumentation>
				<name>COM.TIBCO.hawk.microagent.RuleBaseEngine</name>
				<method>
					<name>TBD</name>
					<description>TBD</description>
				</method>
			</instrumentation>
			<instrumentation>
				<name>COM.TIBCO.hawk.microagent.Self</name>
				<method>
					<name>TBD</name>
					<description>TBD</description>
				</method>
			</instrumentation>
			<instrumentation>
				<name>COM.TIBCO.hawk.microagent.SysInfo</name>
				<method>
					<name>TBD</name>
					<description>TBD</description>
				</method>
			</instrumentation>
		</appInstance>
	</appType>
</applications>
